{
  "schema_version": "1.0",
  "project": "Calder Wheels",
  "artifact_type": "visual_inspector_state",
  "page": "product",
  "reference": "docs/design/mockups/approved-mockups/Calder - 3 - Product.png",
  "baseline": "docs/design/visual-inspector/visual-specs/product.visual-spec.json",
  "status": "READY_FOR_IMPLEMENTATION",
  "current_iteration": 0,
  "current_render": null,
  "latest_correction": null,
  "accepted_render": null
}
